{
  "conflictId": "7bfdbade-2919-4758-ab53-4ddd30c08a3c",
  "sessionId": "mob_session_7b7c6d325d234be7b6cba379ad12c659",
  "entityType": "SET_RECORD",
  "entityId": "mob_set_34599d14fb234ff2837ad7dc453ec21a",
  "localRevision": 9,
  "remoteRevision": 9,
  "localEvent": {
    "protocolVersion": "1.0",
    "schemaVersion": 1,
    "eventId": "44ca234f-7ac5-4c93-8626-d336d29e18ee",
    "sessionId": "mob_session_7b7c6d325d234be7b6cba379ad12c659",
    "type": "SET_UPDATED",
    "timestamp": 1784102600000,
    "source": "PHONE",
    "deviceId": "android-debug-001",
    "revision": 9,
    "payload": { "setId": "mob_set_34599d14fb234ff2837ad7dc453ec21a", "reps": 9 }
  },
  "remoteEvent": {
    "protocolVersion": "1.0",
    "schemaVersion": 1,
    "eventId": "bc7af4b0-bc37-42a9-85f3-327e5e976f52",
    "sessionId": "mob_session_7b7c6d325d234be7b6cba379ad12c659",
    "type": "SET_UPDATED",
    "timestamp": 1784102600100,
    "source": "WATCH",
    "deviceId": "watch-gt4-debug-001",
    "revision": 9,
    "payload": { "setId": "mob_set_34599d14fb234ff2837ad7dc453ec21a", "reps": 8 }
  },
  "detectedAt": 1784102600200,
  "resolution": null,
  "resolvedAt": null
}
